{
  "test_format": "0.1",
  "system_id": "demo.movement",
  "capsule": "movement_gen2.capsule.json",
  "world": "world.json",
  "cases": [
    {
      "name": "v1_from_initial_ticks1",
      "ticks": 1,
      "expected_columns": {
        "position_x": [
          1,
          3,
          0,
          7
        ],
        "velocity_x": [
          1,
          2,
          1,
          0
        ]
      }
    },
    {
      "name": "v1_from_initial_ticks2",
      "ticks": 2,
      "expected_columns": {
        "position_x": [
          2,
          5,
          1,
          7
        ],
        "velocity_x": [
          1,
          2,
          1,
          0
        ]
      }
    },
    {
      "name": "v1_from_initial_ticks3",
      "ticks": 3,
      "expected_columns": {
        "position_x": [
          3,
          7,
          2,
          7
        ],
        "velocity_x": [
          1,
          2,
          1,
          0
        ]
      }
    },
    {
      "name": "v1_from_initial_ticks4",
      "ticks": 4,
      "expected_columns": {
        "position_x": [
          4,
          9,
          3,
          7
        ],
        "velocity_x": [
          1,
          2,
          1,
          0
        ]
      }
    }
  ]
}
