{
  "test_format": "0.1",
  "system_id": "demo.movement",
  "capsule": "capsule.json",
  "world": "world.json",
  "cases": [
    {
      "name": "eq_edges_one_tick",
      "ticks": 1,
      "expected_columns": {
        "position_x": [
          1,
          0,
          0,
          1,
          0
        ],
        "velocity_x": [
          0,
          4294967295,
          0,
          4294967295,
          2
        ]
      }
    }
  ]
}
