{
  "test_format": "0.1",
  "system_id": "demo.movement",
  "capsule": "movement.capsule.json",
  "world": "world.json",
  "cases": [
    {
      "name": "identity_zero_ticks",
      "ticks": 0,
      "expected_columns": {
        "position_x": [
          0,
          1,
          4294967295,
          7
        ],
        "velocity_x": [
          1,
          2,
          1,
          0
        ]
      }
    },
    {
      "name": "one_tick_including_wrap",
      "ticks": 1,
      "expected_columns": {
        "position_x": [
          1,
          3,
          0,
          7
        ],
        "velocity_x": [
          1,
          2,
          1,
          0
        ]
      }
    },
    {
      "name": "three_ticks_from_original",
      "ticks": 3,
      "expected_columns": {
        "position_x": [
          3,
          7,
          2,
          7
        ],
        "velocity_x": [
          1,
          2,
          1,
          0
        ]
      }
    }
  ]
}
